{
  "schema_version":"1.0","fixture_kind":"synthetic","source":{"native_record_id":"fixture-003","url":"https://example.invalid/fixture-003","published_date":"2026-09-05"},
  "filings":[{"source_locator":"pca-1","notification_status":"initial","issuer":{"name_raw":"Relationship Test NV","lei_raw":null},"transacting_party":{"name_raw":"Example Holdings BV","party_type":"legal_entity","status_raw":"Controlled undertaking","pdmr_or_pca":"pca","related_pdmr_name_raw":"Director One","identity_resolution_status":"unresolved"},
  "transaction_groups":[{"group_locator":"pca-buy","instrument":{"name_raw":"Ordinary shares","instrument_type":"ordinary_share"},"nature_raw":"Acquisition by closely associated legal person","action":"acquisition","mechanism":"off_market_trade","consideration":"cash_paid_received","investment_discretion":"unknown","exposure_effect":"increase","trade_date":"2026-09-02","trade_date_precision":"day","eligible_own_money_signal":false,"signal_exclusion_reason":"associated_entity_discretion_unknown","rows":[{"row_locator":"row-1","representation":"individual","price_raw":"10.00 EUR","price_amount_reported":"10","price_currency_normalized":"EUR","quote_unit_scale":"1","quantity_raw":"500","quantity":"500","quantity_unit":"shares","consideration_currency":"EUR"}]}]}]
}
