{
  "schema_version":"1.0","fixture_kind":"synthetic","source":{"native_record_id":"fixture-005","url":"https://example.invalid/fixture-005","published_at":"2026-09-03T08:00:00Z"},
  "filings":[{"source_locator":"multi-action","notification_status":"initial","issuer":{"name_raw":"Plan Test plc","lei_raw":null},"transacting_party":{"name_raw":"Plan Director","party_type":"natural_person","status_raw":"CEO","pdmr_or_pca":"pdmr","identity_resolution_status":"unresolved"},"transaction_groups":[
    {"group_locator":"exercise","instrument":{"name_raw":"Share option","instrument_type":"option"},"nature_raw":"Exercise of options","action":"exercise","mechanism":"option_exercise","consideration":"cash_paid_received","investment_discretion":"evidenced_automatic","exposure_effect":"increase","trade_date":"2026-09-01","trade_date_precision":"day","eligible_own_money_signal":false,"signal_exclusion_reason":"option_exercise_not_cash_purchase_signal","rows":[{"row_locator":"exercise-1","representation":"aggregate","price_raw":"1.00 GBP","price_amount_reported":"1","price_currency_normalized":"GBP","quote_unit_scale":"1","quantity_raw":"1000","quantity":"1000","quantity_unit":"options","consideration_currency":"GBP"}]},
    {"group_locator":"tax-sale","instrument":{"name_raw":"Ordinary shares","instrument_type":"ordinary_share"},"nature_raw":"Sale to satisfy tax liability","action":"disposal","mechanism":"tax_related_sale","consideration":"cash_paid_received","investment_discretion":"evidenced_automatic","exposure_effect":"decrease","trade_date":"2026-09-01","trade_date_precision":"day","eligible_own_money_signal":false,"signal_exclusion_reason":"disposal","rows":[{"row_locator":"sale-1","representation":"aggregate","price_raw":"4.00 GBP","price_amount_reported":"4","price_currency_normalized":"GBP","quote_unit_scale":"1","quantity_raw":"400","quantity":"400","quantity_unit":"shares","consideration_currency":"GBP"}]}
  ]}]
}
